ID	rating	text
ID_100386	10	"I will not spoil anything, don't worry! I've been a fan since 1977,when I saw the original Star Wars with my dad at a cinema theater (exactly where I actually 20 years later would eat lunch with David Prowse...but that's another story!). It changed me from a 7-year old kid to a 7-year old film fan! And, for sentimental and nostalgic reason, nothing can be compared to the original trilogy (1977-1983) if you ask me! Still, I ""kind of"" like the prequel trilogy (1999-2005), even if it can't be compared to the original ones. Maybe a generation thing but they lacked ""fascination"".BUT the new sequel trilogy is on a whole different level! It IS really good! Damn good!!! Why? Because the script has ""feeling"", it introduces new characters that I care for - and that is the most important thing! It's a great script - told with speed like a roller-coaster but JJ Abrams is never forgetting the drama! It's not easy (duuh!) to fulfill all our fan dreams, it's impossible, but hell this is making me long already for the next Episode 8! You understand when you've seen it! Harrison Ford is my favorite actor of all time, actually since 1977 when I first saw Han Solo in action chasing those stormtroopers...so of course it's great to see him return to that galaxy far away a long ago! THAT alone got me SO excited! Hell, the whole planet loves Harrison Ford as Han Solo! He is still going strong, making me wish and hope for INDY 5! Harrison Ford delivers a surprisingly new depth to the saga, he is just great and give the aging Han Solo more ""weight"" (no, he is still in good shape dammit, but you know what I mean!)...but as we all (should) understand this new sequel trilogy is not about the old characters, they are just the link to the new ones. I understand that. Everyone watching it, with certain nostalgic expectations, MUST understand that! Because, seriously,the new star of the Star Wars Saga is the (lovely!) Rey!!! She is just awesome!!! Really really AWESOME!!! I can't believe it, she is the best, most well written female action hero ever!!! Yes! I kid you not. She is interesting and kicking ass! The beautiful and charismatic Daisy Ridley is a new favorite, a new star is born for sure! Hmm. It's night here in Sweden. And I realize now, as I write this about 14 hours after I've seen it here in Sweden, that it's just too much to talk about. So...if anyone is skeptical, just go and see it! I will actually see it again tomorrow - take that as a hint! ;)It's 10/10 for sure! The best film of the year for sure! A worthy sequel for sure! AND best of all, it makes me really honestly ""feel something"" again for this beloved saga, for the first time since 1983!So, yes, the force is wide awake again!!! Gotta love it! :)"
ID_100387		"I was so excited to see this, perhaps too excited. I had watched all of the theory videos and trailer analysis videos and thought I had things figured out. So when I saw it the first time, I went in with preconceived notions and a critical eye, so I ended up disappointed.After reading some other comments saying it was much better the second time, I decided to try again. This time I went in open-minded and tried to view it as pure entertainment, not 'real life.' It was MUCH better that second time. I really enjoyed it. So yeah, OK, I missed on a few of my predictions but so what.So the two main parts that bugged me even after the second time: there were a lot of themes/scenarios that seem repeated from the original trilogy; and there were a handful of deus ex machina type events that gave me some WTF moments.It does end in a cliffhanger, but as the first movie in a trilogy, I can handle that.See it in 3d in a theater with reclining seats."
ID_100388	9	"The first line in this movie is ""This will begin to make things right."" I feel like that's a jab at the prequels. ""Hey, we know the prequels were awful, but this new movie will begin to make things right."" Probably not intentional, but clever nonetheless. My goodness, this movie is so well done! The parallels and metaphors are so cleverly written. Even if you haven't seen any Star Wars movies before, you can watch this as a standalone. Will you get more out of it if you've seen the original trilogy? Of course. Is it essential viewing before going into this one? No. The plot does at times feel ""Been there, seen that,"" because it is essentially a remake of A New Hope. However, there's enough new bits in the story that left me satisfied. The practical effects are so well done, and the very little CGI in the movie looks more realistic than the prequels ever did. There's an important message in the movie, and the characters are relatable. Unlike some of the characters in the prequels, you care about what happens to these new characters. They're acting is great, and the classic actors still feel like their characters. Harrison Ford is still great with the zingers, and C-3PO is still the worrisome robot we all love. J. J. Abrams has restored what we all love about Star Wars. Even before the classic characters show up, it still feels like a Star Wars movie. If the upcoming films are even 1/4 as good as this was, there's a new hope for the Star Wars franchise.
Grade: A- 9/10 4/5 stars"
ID_100389	6	When Return of the Jedi ended its cinema run back in 1983, Star Wars fans were forced to endure a terrible 16-year wait for George Lucas to final greenlight the next instalment, The Phantom Menace (1999). Fan delirium soon turned to head shaking and bewilderment when the result turned out to be a soulless CGI-fest with bad acting and the most annoying character ever to grace the silver screen (narrowly beating Kate Capshaw from Indian Jones and the Temple of Doom). The prequel trilogy mercifully ended in 2006, bringing to a close one of the most disappointing movie events in history.When Disney bought the rights to Lucasfilm in 2012 during a spending spree that would see them also gobble up Marvel and Pixar, they wasted no time at all developing a brand new trilogy and various spin-offs. The wait for the final product was far shorter than the build-up to The Phantom Menace, and I have no doubt that fans will be far more impressed with the result than back in '99. J.J. Abrams' The Force Awakens, subtitled Episode VII, re-captures the spirit of Lucas's original trilogy while correcting the many flaws of the prequels. It has about as much depth as Attack of the Clones - the poorest of the series in my opinion - but makes sure it brings its ensemble of new characters to life while welcoming back a handful of familiar faces.30 years have passed since Luke Skywalker (Mark Hamill) watched his father die while Han Solo (Harrison Ford), Princess Leia (Carrie Fisher) and an army of Ewoks sent the Empire fleeing for their lives. During this time, Luke has fled into hiding following a disastrous attempt to train a new batch of Jedi warriors, and a new enemy named the First Order have emerged in his absence. Resistance pilot Poe Dameron (Oscar Isaac) is sent to the planet Jakku to retrieve a map revealing Luke's location from hooded elder Lor San Tekka (Max von Sydow). However, the First Order - led by the brutal Kylo Ren (Adam Driver) - arrive and capture Poe, destroying Tekka's village in the process.One of Ren's stormtroopers, FN-2187 (John Boyega) - who is later given the name of Finn - has a change of heart following his first experience of battle with the First Order, and helps Poe escape in a TIE fighter. Arriving back at Jakku to retrieve the map from Poe's droid BB-8, Finn comes across scrap metal scavenger Rey (Daisy Ridley) who is taking temporary care of the vulnerable robot, and the two flee together when they are attacked. Stealing a ship that just happens to be the Millennium Falcon, they are soon re-captured by a charismatic smuggler called Han Solo and his furry friend Chewbacca (Peter Mayhew), who understandably want their ship back. Soon enough, Rey and Finn find themselves caught up in an intergalactic war between good and evil.If that all sounds kind-of familiar, then it's probably because you've seen A New Hope (1977) before. It's a thinly-disguised recycling of the same plot, which it turns out works both for and against the film. In many ways, it feels like the natural continuation of the original story that most of us love, suggesting that history does repeat itself and few learn from the errors of the past. It could also be argued as lazy storytelling, copying a proved formula and avoiding the risks that come with taking a familiar world into new territory. While I think both points are valid, I feel it actually works on easing us back into a franchise that many feel was reduced to a laughing stock following the calamity of the prequel trilogy, and this really does feel like Star Wars again, with sets that can actually be touched and CGI aliens that feel full of life.Rey and Finn prove to be multi-dimensional new protagonists while their back-stories are spoken of rather than explored. Abrams exploits their quirks to comedic effect - Boyega in particular is very funny - and both are suitably flawed and poor enough to feel like actual heroes when they finally grab a lightsaber. Ren is also interesting - masked for the bulk of the movie, it's a surprise when he is revealed to be a wet-lipped and long-faced Adam Driver (even though I knew he was under there), prone to immature temper tantrums and facing his own inward dilemma. The movie's main issue is its lack of depth. While the First Order are painted more broadly as Third Reich-esque than before - especially in one ridiculous rally scene in which the pasty-faced General Hux (Domhnall Gleeson) shouts to a meticulously arranged army like a Leni Reifenstahl documentary - we never really understand their motives.And so we are left with a basic good vs. evil story with a startling lack of grey, which may have been refreshingly old-fashioned had the experience not been so similar to A New Hope. Similar to what he did with re-booting the Star Trek franchise, Abrams keeps things light and simple for the most part, treading carefully to avoid overdoing the homages. Chocked full of contrivances that seem like the writers have forgotten that the action is taking place across an entire galaxy, you have to forgive a lot of the films flaws to truly enjoy it, and although this was far from a perfect experience, I was happy to be back in a world that I thought (and hoped) I'd seen the last of. And when the toe-tingling final scene cuts to black, I was quick to check what year the next one is due.
ID_100390	6	This post doesn't contain spoilers.I always valued a good story and character development more than all the rest. The previous movies were not perfect, but I become fond of them in a way. Today I witnessed how money is once again the only thing that matters.Before I even saw the movie I predicted 70% of the story, which is a truly disturbing fact. Cheap jokes and all the unnecessary dialogs were turning the movie second by second into uninteresting and boring adaptation of the previous series. Harrison Jones is a great actor, but his time in Star Wars is over. Time to move on, focus on new heroes, tell us how they feel deep inside, picture their emotions and actions from a different side of view, not just Disney fairy tale, we had enough of this already.I tried to like it, I truly did, but it is too shallow, too simple... As a mediocre star wars fan, going on a midnight premiere in a helm of Kylo Ren, I am disappointed.