ID	rating	text
ID_100372	7	"*SPOILERS* The film alone is watchable, although there is certainly nothing remarkable about it whatsoever. I wont be re-seeing it. A major flaw with the movie is the rather poor story, which includes the usual Abrams plot holes and zero subtleties which are what hold peoples imagination as he seems on a mission that the everything be dumbed down to the lowest common denominator. That the plot actually shares many parts nearly identically with SW ANH cannot be denied, and it was probably done intentionally as a slight tribute/""re-dedication for a new generation"" - oh yay!hooray for nostalgia!... or rather, how about a new story?! Character development: none. Yes, everyone knows they can't give the audience all the information, but really that lack of information on the back story in this film was bizarre and off-putting. The pacing: disjointed. Completely missing is the ""Star Wars feel"" with the intense battle of the Dark and Light side, that even the much-maligned prequels still manage (see ""Duel of the Fates etc). Also, I cannot remember any of the soundtrack after seeing the movie - even the Phantom Menace featured unbelievable scores.Among the most unforgivable of the film are the plot holes that will even have the casual Star Wars fans in disbelief:Here are a few a can still remember: It's all well and good Disney and Abrams slapped the Star Wars fan base in the face by ""un-canonizing"" all of the Expanded Universe literature...but they can't use that excuse for this one -Luke Skywalker would never run away from a Sith that he is responsible for training, especially his nephew.-a ZERO-trained very powerful force user - just nope...I mean, even Anakin Skywalker had to train and there was a Force prophecy about him!-Non-force user non-clone storm trooper using a lightsaber for the first time rather spectacularly against a Sith trained by Luke Skywalker!-non-trained powerful force user, also a lightsaber novice, also manages to defeat a trained Sith lord...folks, do we remember SW ANH where Vader strikes down Obi Wan or SW TPM, where Darth Maul strikes down Qui Gon and almost defeats Obi Wan - yeah, Force Awakens lightsaber duels are a total insult to those... -Kylo Rens light saber not only looks like a joke, but it's design would actually lead to the saber's destruction during a duel as the perpendicular beams are emitted from nodes sticking out at the base of the main blade...ie. as soon as an opponents blade grinds down to the hilt it will be naturally directed to slicing into the lightsaber handle...and also nobody asked for a cheesy lightsaber...Small squadron of old beat up fighters beating an Armada - nopeHow does the resistance all of a sudden no where the weapon planet is? And why didn't they try to destroy it WAY before!!!Aside from the lead, she was pretty good, the acting was sub-par, especially the actor going on about imaginary complaints about a black Storm Trooper...(it was ironic HE was the one making the biggest deal about it!). His ""coming to morality"" killing the village scene nearly ruined the movie for me it was so bad - not only the acting but the 3 finger blood streak was also lame cliché and looked really fake bad.Acting:7 CGI:7 Soundtrack:6 Script:5 Plot:5.5 Character Development:4 Pacing:4Who will bring balance to the Force now?"
ID_100373	8	"This is the movie ""you've all been waiting for"", a grand, classic early 80s Star Wars sequel complete with analogue grain, and the exact same music, credits, shots, battle sequences, characters, plot devices and themes.The movie also has some new spins, details and depth during the battle sequences, and luckily, it IS an emotionally powerful piece of drama, the third act is palpably effective.Is it worth seeing? Well, in the 35 years or whatever since Star Wars came to the screen, there's been a lot of developments in making stylized, fx-heavy violence and spaceship battles on screen, so the movie mostly relies on expensive modern production values that look convincingly like the original Star Wars universe. Also, the story beats happen faster, which in a sense rob depth of a fantasy series that didn't have much in the first place, and often the action sequences smack of frames and stand-offs from the old series.I DID SAY, however, that it has guts. The film feels real, and compelling, and has a sense of drama that relates to the real world, also its commendable that the film has a strong female lead and an African American dude is prominent throughout, although that's not in itself innovative in 2015, its still a nice idea to bring some diversity to the Star Wars franchise, also adds dramatic possibility, something George Lucas clearly had no grasp of in his ""prequel"" trilogy launched in the late nineties.Anyway, writing about Star Wars is a bit like ""dancing about architecture"" to borrow a Frank Zappa phrase on the role of critics, go see it: if you like Star Wars, you'll love this movie. Older viewers, or really anyone familiar with the early installations will occasionally wince at the fact that the movie is nearly entirely a clone of some sort - perhaps the first big reboot of a popular series that's really a note-for-note remake.Generally good acting though, and decent budget, as you'd expect from Disney/Lucasfilm megacorp."
ID_100374	10	"I guess like every fan of the ""Star Wars"" saga, I eagerly awaited this new movie, and was not disappointed (much). I waited long enough until the massive crowds died down enough that I could finally see the picture and not have to worry about sitting in a heavily crowded theater and being constantly distracted by everything that comes along with a large crowd.Alas, I was but one of five people at a 1:15 P.M. showing at my local theater.With the eagerly awaited 2015 ""Star Wars: The Force Awakens,"" I can say that ""Alias"" J.J. Abrams has fashioned a reasonable sequel to the original ""Star Wars"" trilogy that began in 1977 and ended in 1983, as well as the much-beleaguered prequel trilogy that began in 1999 and ended in 2005.The film is not the prequel trilogy and doesn't contain any of its silliness, but it falls short of the epic grandeur of the original trilogy. It's really somewhere in the middle, if you really want to think about it. But I guess, if we were to have a continuation of ""Star Wars"" following the conclusion of ""Return of the Jedi"" (1983), then this was it.This new film is very much a return to the tone and style of the original trilogy, and features a great many nods to those films, while still in other ways continuing the story.People, and George Lucas (creator of the ""Star Wars"" saga), have speculated for years that a follow-up to the original trilogy would be something like ""The Force Awakens,"" where a time after the conclusion of ""Return of the Jedi,"" we would return to many of the principal cast members and some new, fresh faces to the saga, as well.I wasn't disappointed, but aside from a few minor quibbles, this was a worthy entry into the ""Star Wars"" cinematic saga. I look forward to ""Episode VIII"" in a few years.10/10"
ID_100375	10	I have to say I liked the fact this film follows on from the originals and maintains some of its appeal. However there is a true lack of Originality. My first issue is that since Lucas has sold the rights to this, you can see this is a typical Disney style film. By selling out this franchise he has sacrificed a cult classic. The Villain Ren for example, has no evil appeal. He is a soft character and reminds me of a typical Harry Potter style Villain. When you look at characters such as Darth Vader and Darth Maul, this new guy is just weird teenager geek type character reminding me of the villain in KickAss, Red Mist. Secondly Disney is clearly aiming this movie at a younger generation age range 8-15. They are also more concerned with profits than widening the appeal to the masses. Thirdly they used a safe bet storyline rather than using any originality, they have used similar ideas concepts used in the Original Empire strikes back movie.I personally think the Prequels are quite good in comparison to this new generation Star Wars. Especially because I liked the Prequels Originality and new story lines, as well as a wider understanding of new planets in the wider galactic empire. With Force Awakens, be prepared to not feel the same surprise factors felt in all the previous Star Wars movies. On a more positive note, I like that a lot of the Original cast has made a comeback to recreate the epic that was created many decades ago. Apart from that, I hope Lucas found all that extra money worth it because Disney has robbed you man.
ID_100376	10	But that's what makes this J.J Abrams Star Wars movie so great. It borrowed heavily from the original trilogy, making us all feel like kids again and feeling nostalgic. It lays down the same groundwork, the same plots, and allows us to explore the same galaxies/ environments and settings for this galactic space drama for the upcoming sequels. Yet it introduces us to brand new characters that will carry this franchise forward to the new future of star wars.I love Daisey Ridley portrayal of Rey as a down on her luck scruffy scavenger who had a very tough upbringing being all alone and forced to survive based on instincts. I like John Boyega who provided a convincing portrayal of a storm trooper that has gone rogue and who have renounced the First Order evil ways. I like how Lupito animates the smuggler queen, Maz Kanata with her intelligence and yet warmth towards old friends and those in need. Overall the plot points are very similar to Star Wars: A New Hope and it plays out almost the same way except with less star ships? (Whats up with that?) It leaves me wanting more and leaves me with that warm fuzzy feeling of being back in my childhood and relieving that star wars grand story and setting again to be in a fantasy world. SO yes it is absolutely amazing and I loved every minute of it and i would highly recommend the movie to everyone.
ID_100377	6	This one gets lots of hate because it had a familiar story but it did its job and got me hyped for the next saga film. The big shocker is kinda sucky but I understood it from a three film narrative and character building. Sadly all of it was squandered in the end.
ID_100378	6	I rarely write reviews since I guess I am just too lazy at times. But Star Wars is perhaps my favorite franchise and this one kind of killed it for me. There is a trend going for Superhero movies and Marvel releases a bunch of them and have even been going for the minor characters now (Ant Man for example). I believe Disney said they were going to do something similar for Star Wars. So we have here a mash-up of some of the original series (4,5 and 6) with basically nothing new. Now if they had marketed this as a remade New Hope I would have nothing to complain but I was expecting a whole new movie. The common thing with most superhero movies is they get pretty high fan and critic ratings (aberrations being Green Lantern perhaps) and they always succeed in the box office. But the issue is Star Wars was much grander and more innovative. However,now it is all part of the same mold--- you feel good after watching it but it does never leave an impression. Thinking of the prequels, while Episode 1 was a bit bad but there were some redeeming moments---the journey through the underwater world, the pod race and the Maul vs Qui Gon fight. Attack of the clones made things complicated and I actually had to re-watch the whole 1st 3 parts to understand exactly what was happening. Political intrigue and Order 66. And it was great to see how different things were before the Dark Side took over. In this one, nothing seems different---what a disappointment. And it still gets a 8.9....Bleh On a separate note, this is also a very politically correct Star Wars, perhaps the first one which is so. Makes me think if we had any of Lucas' originals releasing now, how would critics and audiences have treated them?
ID_100379		"I know people hate the prequel films; who doesn't. I for one didn't hold Episode 3 in high regard either, but it was at least watchable, to a certain degree. I guess some are not as jaded and cynical as others, but to each his own. For a while, it seem that old magic of the OT couldn't be recaptured or restored to the rightful vision. It seem that Star Wars was doomed to be something of ridicule, rather than the cultural phenomenon that it once was; starting especially of course, with the first film to the last of the OT. But having said that, after coming from seeing TFA, I'm very pleased to report that the force is strong once again in the new film, Star Wars Episode 7: The Force Awakens!! Gone is the cringe-inducing dialog, gone is the stiff, wooden, mechanical acting of the prequels(though they had their moments, but ultimately,uneven)gone is the overuse of CGI without a purpose or support to the story. What is here is what the OT was all about. Well-written characters, superb and at times humorous dialog, great action scenes, but most importantly, a great plot. Without spoiling it, there are numerous twists and turns and even some Easter eggs thrown in for good measure, that while as to remind longtime fans, but surprisingly, add to the overall narrative and it makes the film equally coherent as well as entertaining; something the prequels never achieved despite the high quality production values in accordance with the visuals.Some old faces show up along with some new ones. Leia and the gang are back. It's a treat to see Han Solo again, now with a cynical and world-weary outlook after the music stopped; figuratively speaking. The lead character, played by John Boyega, is both effectively acted and wholly convincing as a former Stormtrooper who does a complete 180 in his place in the galaxy and for better or worse, it's very fun to watch. Daisy Ridley was good as Rey, but I'd hoped to see a little more of her. But I was fascinated by Kylo Ren. Not only does he look imposing, but also menacing as the new Sith Lord on the block, with shadowy and ominous Supreme Leader Snoke, to back him up in their evil path to universal conquest of the galaxy.Sure some of the dialog is hammy and at times corny, as well as some gaps in logic, but that's what to be expected of Star Wars. Why some hold the OT over this film is beyond me,but I guess some people are not satisfied with what this film has to offer.The only gripe I have is while that some scenes are nice and homage the original trilogy, the film-makers played it a little too safe; not offering more new and unexpected, not being bold enough or try new things. Though this implies that they don't want to repeat the same mistakes as the prequel films, they could've flexed their muscles a little more and go for something more epic and grander than having to rely on homage to what was already established before.So in conclusion, this is a very well-made and solid film and although veterans of the series may not view it in the same light as the OT, Some,like me, takes a fresh approach. The force is strong again with this one. Hopefully the next film will be bolder, darker, and more daring than ever before."
ID_100380	10	I'm not going to say much about this outstanding sequel film, but this Episode 7 alone rips the last three apart with the force! LOL!The last three were pretty good, but this one Jedi crushed em all! I can't wait for episode 8! A mash up on the classic film and the new ones, which in turn is absolutely amazing!!The cast were phenomenal!Story and action are perfect!Im not a big fan but i think i am now!Definitely getting this on blu-ray!
ID_100381	8	The Force Awakens is better than all of the prequel trilogy movies. It has a lot of scenes that are similar to A New Hope. That doesn't effect the movie in a negative manner but boosts the audiences interest in it. The characters are amazing and the reveals are brilliant. They make X wing pilots cool and bring a whole new take on the story that does a great job at continuing the story from the original trilogy. I felt a lot of emotion watching this and am glad that a new generation will be introduced to Star Wars in such an amazing way. I grew up watching the prequel trilogy and it did its job at hooking the next generation on the Star Wars saga. This sequel trilogy will continue to add a new generation to this saga.
ID_100382	6	I'll start by saying I'm far from being a 'Star Wars' fanatic, or for that matter even really a fan. I happen to have seen all the movies to date and can appreciate them for what they are, but they are not really my preferred cup of tea. Hell, it took me almost 12 months to get around to seeing this entry into the series. All that said, I was still a little bit disappointed by 'Star Wars: Episode VII - The Force Awakens' simply because I expected more. I expected more in the way of a complex story and I expected more in the way of new characters. 'Kylo Ren' really didn't do it for me as the main villain. Obviously he had huge shoes to fill the terms of 'Darth Vadar' (this is even touched on in the movie), but I still feel like a better job could have been done. Also the story, while pleasantly easy to follow, felt like it was lacking in creativity. When your come to a 'Star Wars' movie you're prepared for a little bit of complexity.What I did really enjoy was the pacing of the film. It has a 136 minute run time and yet it feels like your standard 90 minute film, because it just flies by. When the credits rolled I remember thinking to myself moments before that there must be about 30 minutes to go. Daisy Ridley also immensely impressed me as the main protagonist. She was likable, charismatic and impressive in the action scenes. The only work-on for her before the next film would be her line delivery at times comes across a little fumbled. That shouldn't be too hard to fix.It's hard for me to guess how true 'Star Wars' fanatics are going to feel about this film, but I can tell you that for average folk like myself it's a watchable experience, but not a lot more.
ID_100383	9	"This review of ""Star Wars: The Force Awakens"" will be necessarily brief, for fear of spoilers. And when I say ""fear of spoilers,"" I really do mean FEAR of spoilers. There are people out there who will burn your house down if you ruin this long-awaited film's surprises.I really liked it. I would somewhat grudgingly give it a 9 out of 10, as I can't match the sheer ardor its global legions of fans. (Yes, ""Star Wars"" was a big part of my childhood, but I have more or less gotten over it. I read last night, for example, that filmmaker Kevin Smith actually cried upon stepping aboard the Millennium Falcon when he visited the set; I am not quite as nostalgic as that.)In short, it absolutely succeeds as a fun space fantasy, and recaptures the spirit of the original ""Holy Trilogy."" It easily surpasses the much-maligned prequels on nearly every level, including screen writing, acting and special effects. The predominance of practical effects over those that are exclusively digital make this movie's universe feel ""real"" and ""lived in.""We finally have relatable characters again who sound real, and who can invite viewer sympathy. The dramatic interaction among our newer heroes and returning icons is both logical and emotionally involving. I was surprised at how well this movie handled the passing of the torch. It was a kind of skilled storytelling that was almost entirely absent from the last three films. And the special effects were top notch.My only mild quibbles might reflect a greater degree of objectivity that you might hear from someone who is not a raging fan of the series. This film so closely parallels the original ""Star Wars"" (1978) that at times it started to feel like a remake. Were the similarities in structure, characters, plot points, planets and villains all an intentional homage? I suggest that our bad guys here, for example, sometimes feel interchangeable with those of past ""Star Wars"" films. I want to say more, but can't, because of spoilers. Am I the only person who noticed these things?I also submit that, like a few other ""Star Wars"" movies, our characters are rendered with little depth, with sparse information about their skills, motivations, backgrounds or ideosyncrasies. The dialogue is thin. Consider lines like ""He's my friend!"" and ""Because it's the right thing to do."" And we are presented with no information why the speaker here is so noble, when others are not. Even if the screen writing here is better than the prequels, it's still not Tennessee Williams.It's all very forgivable, I guess, just so long as the viewer remembers that they're sitting down to an installment in a film franchise originally intended for young people. It's kid stuff. It's really, really good kid stuff, but it's kid stuff. (Don't burn my house down!)And the reason I chose a 9 rating instead of an 8 was primarily the enjoyment I got from seeing familiar faces. The return of our icons was surprisingly well depicted and, if you loved ""Star Wars"" as a kid, then that should be enough to make this a ""must-see"" movie."
ID_100384	6	The Force Awakens is an exciting new chapter to the SW saga. But there are problems, which it would be easy to get overly critical about. First off, what they got right about this film. New characters: on the surface they're different and compelling enough to enjoy. But at times they lack depth (and maybe even maturity). Perhaps that was by design to appeal more to kids. Next (what I like to call) environmental moments! An example of that is in #1 when Anakin is pod racing, a group of sand people are watching & take a shot at one of the pod racers, causing him to crash. Or in #4 when on Tatooine, they enter Mos Eisley in Luke's land speeder, a Jawa can be seen struggling to control a Rhonto beast. It seems like unimportant details, but it goes a long way to making SW seem real (and not just some visually impressive trip thru a fantasy universe)! While not achieving a George Lucas level, JJ Abrams did a respectable job at this, and frankly I don't know if other directors would've even grasped that. As always, the special effects & sound effects are top notch. The action and pace of the movie are done well too. If anything it could've slowed down in a few spots to help add a little more depth to some of the characters. The visual look of the film is commendable. Traditional SW but tweaked just enough to convey a newness to it (examples: storm trooper outfits, TIE fighters, etc)... And now for what's wrong with this movie!! Large holes in character background. While this seems to be a big source of complaint from fans, especially because it lends to unexplained inconsistencies in some of the major characters. Everyone should try and chill out!! Some of this will be covered in the next movie (probably). Some of it will be revealed in the commercial empire of the SW after market (in such things as toys, games, collectors cards, and possibly TV shows & cartoons). We will have to wait and see if it covers all the significant inconsistencies... Having said that, the sheer volume of it is annoying!! More than any other SW movie. Next issue: disappointing performances by the old cast. Han is Han! One of the strongpoints of the film. Leia, at times seems like she's coming down off a hangover, but at other times gives a convincing performance. Even Chewbacca gives a deadpan performance at one important point in the movie.The villain, Kylo Ren, while not being a big disappointment, is a mixed bag. The biggest flaw by far is the plot. The plot is heavily, heavily, heavily recycled!! So much so that it can't be overstated! (Hence the title of this review)! Hopefully the next SW will fix some of the character background issues. But unless they correct the totally unoriginal plot... then, just like in this movie... great visual effects, a great pace, and somewhat compelling characters will not be enough to make up for it.
ID_100385	8	This movie was amazing it is the perfect follow up to the original trilogy. the writing and acting was perfect along with the special effects. it is great to see old characters return as well as meet brand new characters. this movie is a must for true Star Wars fans.
